{"allocator_config_digest":"b3c1b4493556d93773df5f4302fd7daa127755c782273d6041c413ed08ecac80","assessments":[{"assessment_digest":"8cbd9342e5866e9aae3aae2ea6d4c33b6053342c91ef9d1c79b8bd7e5ea5f097","case_id":"EQ-F01-DEV-01"},{"assessment_digest":"264a0bbd27a089c6e1b37211ae9bd3003d8343d0f2550d8a8deae22593e93117","case_id":"EQ-F02-DEV-01"},{"assessment_digest":"562da582dadea0eeec04faf369dc7ac0a6f7e3b5e7b312a01bd9bd136f5a0c82","case_id":"EQ-F01-DEV-02"},{"assessment_digest":"45c995c71f95c3b0f8b58a239d9813c9fe3ba248262691823243a986d14786a6","case_id":"EQ-F02-DEV-02"}],"corpus_digest":"ff509d989d9b2de1602528fc2b8c6a8d857786cc8b2c0c98456975c433c3ff61","evaluation_run_id":"judge-fixture-run-v1","first_excluded_case_id":"EQ-F02-DEV-01","receipt_id":"judge-fixture-receipt-v1","review_budget":1,"review_queue":["EQ-F01-DEV-01"],"schema_version":"1.0","selection_boundary":{"excluded_case_id":"EQ-F02-DEV-01","excluded_deterministic_score":70,"excluded_risk_score":80,"excluded_status":"risk_finding"},"split_digest":"e0531d96c0a8b8d96233f4dcac9ce9b3383db87d0d9ac101c746b766dfc8b46a"}